{
  "$schema": "https://json-schema.org/draft/2020-12/schema",
  "$id": "https://runcriticon.com/schemas/club_taxonomia/alumno-asignado-a-grupo-v1.json",
  "title": "AlumnoAsignadoAGrupo",
  "description": "Un alumno entra en un grupo por excepción manual (módulo club_taxonomia, LAL-94). No cubre la entrada por cambio de tags.",
  "type": "object",
  "required": ["eventId", "aggregateId", "occurredAt", "version", "clubId", "groupId"],
  "properties": {
    "eventId": { "type": "string", "format": "uuid" },
    "aggregateId": { "type": "string", "format": "uuid", "description": "Id del alumno que entra en el grupo" },
    "occurredAt": { "type": "string", "format": "date-time" },
    "version": { "type": "integer", "minimum": 1 },
    "clubId": { "type": "string", "format": "uuid" },
    "actorId": { "type": ["string", "null"], "format": "uuid" },
    "traceparent": { "type": ["string", "null"] },
    "groupId": { "type": "string", "format": "uuid" }
  },
  "additionalProperties": false
}
